{
  "$schema": "https://json-schema.org/draft/2020-12/schema",
  "type": "object",
  "properties": {
    "protocol": {
      "type": "string",
      "const": "wfd-data"
    },
    "schema_version": {
      "type": "string",
      "const": "1.0"
    },
    "epoch": {
      "type": "integer",
      "exclusiveMinimum": 0,
      "maximum": 9007199254740991
    },
    "sequence": {
      "type": "integer",
      "exclusiveMinimum": 0,
      "maximum": 9007199254740991
    },
    "release_id": {
      "type": "string",
      "pattern": "^[0-9a-z.-]+$"
    },
    "issued_at": {
      "type": "string",
      "format": "date-time",
      "pattern": "^(?:(?:\\d\\d[2468][048]|\\d\\d[13579][26]|\\d\\d0[48]|[02468][048]00|[13579][26]00)-02-29|\\d{4}-(?:(?:0[13578]|1[02])-(?:0[1-9]|[12]\\d|3[01])|(?:0[469]|11)-(?:0[1-9]|[12]\\d|30)|(?:02)-(?:0[1-9]|1\\d|2[0-8])))T(?:(?:[01]\\d|2[0-3]):[0-5]\\d:[0-5]\\d(?:\\.\\d+)?(?:Z|([+-](?:[01]\\d|2[0-3]):[0-5]\\d)))$"
    },
    "expires_at": {
      "type": "string",
      "format": "date-time",
      "pattern": "^(?:(?:\\d\\d[2468][048]|\\d\\d[13579][26]|\\d\\d0[48]|[02468][048]00|[13579][26]00)-02-29|\\d{4}-(?:(?:0[13578]|1[02])-(?:0[1-9]|[12]\\d|3[01])|(?:0[469]|11)-(?:0[1-9]|[12]\\d|30)|(?:02)-(?:0[1-9]|1\\d|2[0-8])))T(?:(?:[01]\\d|2[0-3]):[0-5]\\d:[0-5]\\d(?:\\.\\d+)?(?:Z|([+-](?:[01]\\d|2[0-3]):[0-5]\\d)))$"
    },
    "previous_release_hash": {
      "anyOf": [
        {
          "type": "string",
          "pattern": "^[a-f0-9]{64}$"
        },
        {
          "type": "null"
        }
      ]
    },
    "minimum_client_protocol": {
      "type": "string",
      "const": "1.0"
    },
    "demo": {
      "type": "boolean"
    },
    "artifacts": {
      "minItems": 1,
      "maxItems": 20000,
      "type": "array",
      "items": {
        "type": "object",
        "properties": {
          "path": {
            "type": "string",
            "pattern": "^(?:index\\/companies\\.json|shards\\/[a-f0-9]{64}\\.json|directory\\.(?:json|sqlite)|(?:rules|mirrors|approvals|reviewer-authority)\\.json|(?:companies|public-changes)\\.jsonl)$"
          },
          "sha256": {
            "type": "string",
            "pattern": "^[a-f0-9]{64}$"
          },
          "byte_length": {
            "type": "integer",
            "minimum": 0,
            "maximum": 268435456
          },
          "media_type": {
            "type": "string",
            "minLength": 1,
            "maxLength": 500
          }
        },
        "required": [
          "path",
          "sha256",
          "byte_length",
          "media_type"
        ],
        "additionalProperties": false
      }
    }
  },
  "required": [
    "protocol",
    "schema_version",
    "epoch",
    "sequence",
    "release_id",
    "issued_at",
    "expires_at",
    "previous_release_hash",
    "minimum_client_protocol",
    "demo",
    "artifacts"
  ],
  "additionalProperties": false
}