{"artifacts":[{"byte_length":3110,"media_type":"application/json","path":"shards/a3018219fb9d6edb6e3d23c016f966a3fd4f4a9685f1b2b97cad588ad6a82280.json","sha256":"a3018219fb9d6edb6e3d23c016f966a3fd4f4a9685f1b2b97cad588ad6a82280"},{"byte_length":3235,"media_type":"application/json","path":"index/companies.json","sha256":"a98a60710ffae4d8871c4efb8539f248c1e292e8021b73c2054c05c95c30b1b0"},{"byte_length":6733,"media_type":"application/json","path":"directory.json","sha256":"fc9802781af076523237abe016261a527ef0e9e0c0764e5725dc30e06dc0dd69"},{"byte_length":245,"media_type":"application/json","path":"rules.json","sha256":"0e9e80ce9af1c0a99dfe943553b41a0924b758540b5a43d865a772ba8a97fc9d"},{"byte_length":2,"media_type":"application/json","path":"mirrors.json","sha256":"4f53cda18c2baa0c0354bb5f9a3ecbe5ed12ab4d8e11ba873c2f11161202b945"},{"byte_length":3111,"media_type":"application/x-ndjson","path":"companies.jsonl","sha256":"ff2aecd998e2a15c387e39ab283ca0e2abc77daab4764228b2a17b0a269e6627"},{"byte_length":1,"media_type":"application/x-ndjson","path":"public-changes.jsonl","sha256":"01ba4719c80b6fe911b091a7c05124b64eeece964e09c058ef8f9805daca546b"},{"byte_length":20480,"media_type":"application/vnd.sqlite3","path":"directory.sqlite","sha256":"884864a26869ce0b8516a07df9334a8d6aaa6fc25a3a8bc43544079a000809b0"}],"demo":true,"epoch":1,"expires_at":"2026-09-14T12:33:21.103Z","issued_at":"2026-09-12T13:33:21.103Z","minimum_client_protocol":"1.0","previous_release_hash":null,"protocol":"wfd-data","release_id":"2026-09-12.1","schema_version":"1.0","sequence":1}