{"artifacts":[{"byte_length":2831,"media_type":"application/json","path":"shards/05ecac27913ef4c730360b7111a3299d7f419abdb92057e286c8857531732ec2.json","sha256":"05ecac27913ef4c730360b7111a3299d7f419abdb92057e286c8857531732ec2"},{"byte_length":2956,"media_type":"application/json","path":"index/companies.json","sha256":"9bec07d1f51e89c21ff8f0161f24e96652a437cd9fe8739eb9582b1c82a3084e"},{"byte_length":3521,"media_type":"application/json","path":"directory.json","sha256":"3b48dd31809b40eece7ecca7653b3b8d0535f8897f13f21af881a772eeee12f0"},{"byte_length":245,"media_type":"application/json","path":"rules.json","sha256":"0e9e80ce9af1c0a99dfe943553b41a0924b758540b5a43d865a772ba8a97fc9d"},{"byte_length":2,"media_type":"application/json","path":"mirrors.json","sha256":"4f53cda18c2baa0c0354bb5f9a3ecbe5ed12ab4d8e11ba873c2f11161202b945"},{"byte_length":2832,"media_type":"application/x-ndjson","path":"companies.jsonl","sha256":"406fb1c658df14f0b7dc6816479f605ff6d28b71f0f1e9eff2861f0ac7560d93"},{"byte_length":1,"media_type":"application/x-ndjson","path":"public-changes.jsonl","sha256":"01ba4719c80b6fe911b091a7c05124b64eeece964e09c058ef8f9805daca546b"},{"byte_length":12288,"media_type":"application/vnd.sqlite3","path":"directory.sqlite","sha256":"e44622b03dfed36a600c77d949e47e1e56eb2d6215772ffd4fde218cf20aa8a4"}],"demo":true,"epoch":1,"expires_at":"2026-09-14T10:25:14.413Z","issued_at":"2026-09-12T11:25:14.413Z","minimum_client_protocol":"1.0","previous_release_hash":null,"protocol":"wfd-data","release_id":"2026-09-12.1","schema_version":"1.0","sequence":1}